{
    "$schema":  "https://authz.xbac/schemas/gov/bo-meta-fragment.schema.json",
    "tenantId":  "default",
    "appCode":  "government",
    "boCode":  "SCENE",
    "metaType":  "MODEL",
    "draftVersion":  1,
    "schemaVersion":  "2.0",
    "content":  {
                    "boCode":  "SCENE",
                    "boName":  "场景",
                    "description":  "场景管理业务对象，采用主从明细聚合建模。",
                    "apiConfig":  {
                                      "resourcePath":  "/scenes",
                                      "idField":  "id",
                                      "idType":  "LONG",
                                      "businessKeyField":  "scene_no",
                                      "aggregateApiPolicy":  {
                                                                 "listProjectionScope":  "ROOT_SUMMARY",
                                                                 "readScope":  "FULL_AGGREGATE",
                                                                 "createScope":  "FULL_AGGREGATE",
                                                                 "updateScope":  "ROOT_ENTITY_ONLY",
                                                                 "deleteScope":  "CASCADE_AGGREGATE",
                                                                 "orphanPolicy":  "DENY_DELETE_WHEN_CHILD_EXISTS",
                                                                 "detailEmbedEntities":  [
                                                                                              "scene_product",
                                                                                              "scene_product_accessory",
                                                                                              "scene_annual_estimate",
                                                                                              "scene_rival_summary",
                                                                                              "scene_rival_detail",
                                                                                              "scene_team_member"
                                                                                          ],
                                                                 "aggregateReplaceActionPath":  "replace-aggregate",
                                                                 "alternateAggregateApis":  [
                                                                                               {
                                                                                                   "code":  "GET_SCENE_ROOT",
                                                                                                   "name":  "查询场景主实体",
                                                                                                   "method":  "GET",
                                                                                                   "path":  "/scenes/{id}/root",
                                                                                                   "requestScope":  "NONE",
                                                                                                   "responseScope":  "ROOT_ENTITY_ONLY",
                                                                                                   "resultType":  "ApiResponse<SceneRootDTO>",
                                                                                                   "description":  "只返回 scene_main 主实体字段，不内嵌产品清单、竞对和团队成员。"
                                                                                               },
                                                                                               {
                                                                                                   "code":  "CREATE_SCENE_ROOT",
                                                                                                   "name":  "创建场景主实体",
                                                                                                   "method":  "POST",
                                                                                                   "path":  "/scenes/root",
                                                                                                   "requestScope":  "ROOT_ENTITY_ONLY",
                                                                                                   "responseScope":  "ROOT_ENTITY_ONLY",
                                                                                                   "resultType":  "ApiResponse<SceneRootDTO>",
                                                                                                   "description":  "只创建 scene_main 主实体，产品清单、竞对和团队成员后续通过子实体接口维护。"
                                                                                               },
                                                                                               {
                                                                                                   "code":  "PATCH_SCENE_AGGREGATE",
                                                                                                   "name":  "增量更新完整场景聚合",
                                                                                                   "method":  "PATCH",
                                                                                                   "path":  "/scenes/{id}/aggregate",
                                                                                                   "requestScope":  "FULL_AGGREGATE_PATCH",
                                                                                                   "responseScope":  "FULL_AGGREGATE",
                                                                                                   "resultType":  "ApiResponse<SceneDTO>",
                                                                                                   "description":  "显式增量更新完整聚合，允许同时提交主实体和子实体变更。"
                                                                                               },
                                                                                               {
                                                                                                   "code":  "REPLACE_SCENE_AGGREGATE",
                                                                                                   "name":  "替换完整场景聚合",
                                                                                                   "method":  "POST",
                                                                                                   "path":  "/scenes/{id}/replace-aggregate",
                                                                                                   "requestScope":  "FULL_AGGREGATE_REPLACE",
                                                                                                   "responseScope":  "FULL_AGGREGATE",
                                                                                                   "resultType":  "ApiResponse<SceneDTO>",
                                                                                                   "description":  "显式替换完整聚合，整体替换主实体与子实体。"
                                                                                               }
                                                                                           ]
                                                             },
                                      "searchEnabled":  true,
                                      "batchEnabled":  true
                                  },
                    "boConfig":  {
                                     "objectType":  "MASTER_DETAIL",
                                     "nameField":  "scene_name_dept",
                                     "statusField":  "status",
                                     "logicDeleteFlag":  true,
                                     "versionFlag":  false,
                                     "defaultSort":  {
                                                         "field":  "create_time",
                                                         "direction":  "desc"
                                                     }
                                 },
                    "entities":  [
                                     {
                                         "code":  "scene_main",
                                         "name":  "场景主实体",
                                         "isPrimary":  true,
                                         "aggregateRole":  "ROOT",
                                         "tableName":  "gov_scene",
                                         "attributes":  [
                                                            {
                                                                "code":  "id",
                                                                "name":  "场景ID",
                                                                "type":  "LONG",
                                                                "isPk":  true,
                                                                "semanticRole":  "TECHNICAL_ID",
                                                                "filterable":  false
                                                            },
                                                            {
                                                                "code":  "scene_no",
                                                                "name":  "场景编号",
                                                                "type":  "STRING",
                                                                "isPk":  false,